{
  "schema_id": "gait.gate.delegation_token",
  "schema_version": "1.0.0",
  "created_at": "2026-08-01T12:00:00Z",
  "producer_version": "v1.5.0",
  "token_id": "bfedc0181e117708be5c3ac5",
  "delegator_identity": "root@example",
  "delegate_identity": "child@example",
  "scope": [
    "write"
  ],
  "intent_digest": "aaaaaaaaaaaaaaaaaaaaaaaaaaaaaaaaaaaaaaaaaaaaaaaaaaaaaaaaaaaaaaaa",
  "policy_digest": "bbbbbbbbbbbbbbbbbbbbbbbbbbbbbbbbbbbbbbbbbbbbbbbbbbbbbbbbbbbbbbbb",
  "expires_at": "2026-08-01T14:00:00Z",
  "signature": {
    "alg": "ed25519",
    "key_id": "ec7805c87586f0415bba3377d1faad498e48f3165832f3522eca61d7d5926a3f",
    "sig": "s5VnuRxzz0lVbt8C6o0FuaUByfl1uG9WhnYNj4xqe9selosNksUTPn/UaWEyzP5nE0q7xSY+SuHJTw1dH7MBCA==",
    "signed_digest": "2c8dd08698d318fda3b81fb8d89e928cdf6d532572da1c6453135816dc8024af"
  },
  "action_classes": [
    "write"
  ],
  "target_scope": [
    "repo:fixture"
  ],
  "environment_scope": [
    "prod"
  ],
  "data_classes": [
    "internal"
  ],
  "network_destinations": [
    "api.example"
  ],
  "max_operations": 4,
  "max_targets": 2,
  "max_descendant_depth": 2,
  "contract_digest": "cccccccccccccccccccccccccccccccccccccccccccccccccccccccccccccccc",
  "origin_authority_digest": "dddddddddddddddddddddddddddddddddddddddddddddddddddddddddddddddd"
}
